{
  "$schema": "https://json-schema.org/draft/2020-12/schema",
  "$id": "https://pbl6.local/legal_knowledge_graph/document.schema.json",
  "title": "Legal Knowledge Graph Document Mapping",
  "description": "Một file JSON = một văn bản (map 1-1 từ data/clean/text_final/*.txt). Người map chỉ điền giá trị THÔ (chuỗi in trên văn bản) — mọi khoá chuẩn hoá (normalizedNumber, orgId, contentId, articleId, personId) do core/ingest/graph_model.py (qua core/normalize.py) tự suy ra, KHÔNG được tự điền trừ khi dùng idOverride.",
  "type": "object",
  "required": ["schemaVersion", "document", "organization"],
  "additionalProperties": false,
  "properties": {
    "schemaVersion": { "const": "1.0" },
    "sourceFile": {
      "type": ["string", "null"],
      "description": "Tên/đường dẫn file .txt gốc trong data/clean/text_final/, để truy vết. Bỏ trống/null với file mock synthetic."
    },
    "mappedBy": {
      "type": ["string", "null"],
      "description": "Tên hoặc email người map, tự do điền, chỉ để ghi chú."
    },
    "note": {
      "type": ["string", "null"],
      "description": "Ghi chú tự do của người map (chỗ nào không chắc, cần soi lại...). Không nạp vào Neo4j."
    },
    "document": { "$ref": "#/$defs/document" },
    "organization": { "$ref": "#/$defs/organization" },
    "signers": {
      "type": "array",
      "default": [],
      "items": { "$ref": "#/$defs/signer" }
    },
    "citations": {
      "type": "array",
      "default": [],
      "items": { "$ref": "#/$defs/citation" }
    },
    "mentions": {
      "type": "array",
      "default": [],
      "items": { "type": "string", "minLength": 1 },
      "description": "Tên tổ chức được NHẮC TỚI trong thân văn bản nhưng không phải cơ quan ban hành/ký. Không cần đếm số lần."
    },
    "normativeContents": {
      "type": "array",
      "default": [],
      "items": { "$ref": "#/$defs/normativeContent" }
    },
    "articles": {
      "type": "array",
      "default": [],
      "items": { "$ref": "#/$defs/article" },
      "description": "Điều nằm TRỰC TIẾP dưới Document (VD: Luật/Nghị định không có Quy định kèm theo, hoặc các Điều 'vỏ bọc' của một Quyết định — Điều 1 'Ban hành kèm theo...', Điều 2 'Hiệu lực thi hành...'). Có thể tồn tại ĐỒNG THỜI với normativeContents — đây là trường hợp PHỔ BIẾN, không phải cạnh biên."
    }
  },
  "$defs": {
    "document": {
      "type": "object",
      "required": ["documentNumber", "title", "documentType"],
      "additionalProperties": false,
      "properties": {
        "documentNumber": {
          "type": "string",
          "minLength": 1,
          "maxLength": 80,
          "description": "Chép nguyên văn như in trên văn bản, VD '10/2020/QĐ-ĐHBK'. Văn bản không có số hiệu thật thì đặt nhãn tự đặt dạng 'VB-<mô tả ngắn>' và bắt buộc điền idOverride trùng giá trị này."
        },
        "title": { "type": "string", "minLength": 1 },
        "documentType": {
          "type": "string",
          "enum": [
            "Luật", "Pháp lệnh", "Nghị định", "Thông tư",
            "Thông tư liên tịch", "Quyết định", "Nghị quyết",
            "Chỉ thị", "Hướng dẫn", "Kế hoạch",
            "Văn bản hợp nhất", "Lệnh", "Công văn", "Hiến pháp"
          ]
        },
        "status": {
          "type": ["string", "null"],
          "enum": ["CON_HIEU_LUC", "HET_HIEU_LUC", "CHUA_HIEU_LUC", null]
        },
        "issueDate": { "$ref": "#/$defs/vnDate" },
        "effectiveDate": { "$ref": "#/$defs/vnDate" },
        "expiryDate": { "$ref": "#/$defs/vnDate" },
        "fileUrl": {
          "type": ["string", "null"],
          "format": "uri"
        },
        "topics": {
          "type": "array",
          "default": [],
          "items": { "type": "string", "minLength": 1 },
          "description": "Tên lĩnh vực — PHẢI khớp (không phân biệt hoa/thường, có/không dấu) một mục trong reference/topics_seed.json. Kiểm tra ở validate.py, không phải ở JSON Schema."
        },
        "targetGroups": {
          "type": "array",
          "default": [],
          "items": { "type": "string", "minLength": 1 },
          "description": "Đối tượng áp dụng (Điều 1/2 'Phạm vi điều chỉnh và đối tượng áp dụng'), có thể nhiều hơn 1. Tên PHẢI khớp (không phân biệt hoa/thường, có/không dấu) một mục trong reference/target_groups_seed.json — dùng 'Khác' nếu không khớp rõ nhóm nào. Kiểm tra ở validate.py, không phải ở JSON Schema."
        },
        "summary": {
          "type": ["string", "null"],
          "maxLength": 600,
          "description": "1-3 câu tóm tắt do người map viết. KHÔNG chép lại toàn văn — toàn văn thuộc về articles[].text."
        },
        "idOverride": {
          "type": ["string", "null"],
          "description": "Ép normalizedNumber về đúng giá trị này thay vì để loader tự suy. Chỉ dùng khi cần (đụng hàng, văn bản không có số hiệu chuẩn)."
        }
      }
    },
    "vnDate": {
      "type": ["string", "null"],
      "pattern": "^\\d{2}/\\d{2}/\\d{4}$",
      "description": "Ngày như in trên văn bản, dạng dd/mm/yyyy. Loader tự đổi sang ISO khi nạp."
    },
    "organization": {
      "type": "object",
      "required": ["name"],
      "additionalProperties": false,
      "properties": {
        "name": { "type": "string", "minLength": 1 },
        "orgType": {
          "type": ["string", "null"],
          "enum": [
            "quoc_hoi", "chinh_phu", "thu_tuong", "bo_nganh",
            "dai_hoc_vung", "truong_thanh_vien",
            "don_vi_truc_thuoc", "phong_ban", null
          ],
          "description": "Bắt buộc điền nếu 'name' KHÔNG có trong reference/organizations_seed.json (kiểm tra ở validate.py). Nếu có trong seed thì để null, loader tự lấy."
        },
        "parentOrg": {
          "type": ["string", "null"],
          "description": "Tên cơ quan cấp trên trực tiếp (raw), dùng dựng PART_OF. Bỏ trống nếu là cơ quan gốc hoặc đã có trong seed (loader tự lấy parentOrg từ seed)."
        },
        "idOverride": { "type": ["string", "null"] }
      }
    },
    "signer": {
      "type": "object",
      "required": ["fullName", "position"],
      "additionalProperties": false,
      "properties": {
        "fullName": { "type": "string", "minLength": 1 },
        "academicTitle": { "type": ["string", "null"] },
        "position": {
          "type": "array",
          "minItems": 1,
          "items": { "type": "string", "minLength": 1 },
          "description": "Chức danh trên chữ ký của văn bản này. Có thể có nhiều hơn 1 nếu văn bản ghi kiêm nhiệm."
        },
        "idOverride": { "type": ["string", "null"] }
      }
    },
    "citation": {
      "type": "object",
      "required": ["targetDocumentNumber", "relationType"],
      "additionalProperties": false,
      "properties": {
        "targetDocumentNumber": {
          "type": "string",
          "minLength": 1,
          "description": "Số hiệu văn bản được trích dẫn, chép nguyên văn. Không cần văn bản đích đã được map — nếu chưa có, loader tự tạo Document stub."
        },
        "relationType": {
          "type": "string",
          "enum": ["BASED_ON", "REFERENCES", "REPLACES", "AMENDS", "REPEALS"]
        },
        "targetArticle": {
          "type": ["string", "null"],
          "pattern": "^Điều\\s+\\d+[a-zA-Z]?$",
          "description": "Chỉ dùng cho AMENDS khi biết rõ điều nào của văn bản đích bị sửa. Lưu như một thuộc tính mô tả trên cạnh, KHÔNG resolve thành cạnh riêng tới node Article cụ thể ở v1 (cắt phạm vi có chủ đích)."
        },
        "context": {
          "type": ["string", "null"],
          "maxLength": 400,
          "description": "Trích đoạn câu 'Căn cứ...' / 'thay thế...' / 'sửa đổi, bổ sung...' / 'bãi bỏ...' làm bằng chứng. Không bắt buộc nhưng nên điền để dễ kiểm tra sau này."
        }
      }
    },
    "normativeContent": {
      "type": "object",
      "required": ["title", "contentType", "articles"],
      "additionalProperties": false,
      "properties": {
        "title": { "type": "string", "minLength": 1 },
        "contentType": {
          "type": "string",
          "enum": [
            "Quy định", "Quy chế", "Điều lệ", "Quy trình",
            "Nội quy", "Đề án", "Kế hoạch", "Hướng dẫn", "Chương trình", "Phụ lục"
          ]
        },
        "status": {
          "type": ["string", "null"],
          "enum": ["CON_HIEU_LUC", "HET_HIEU_LUC", "CHUA_HIEU_LUC", null],
          "description": "Để null thì loader lấy theo status của Document cha (nội dung kèm theo hết hiệu lực cùng lúc với quyết định ban hành nó)."
        },
        "idOverride": { "type": ["string", "null"] },
        "articles": {
          "type": "array",
          "minItems": 1,
          "items": { "$ref": "#/$defs/article" }
        }
      }
    },
    "article": {
      "type": "object",
      "required": ["number", "text"],
      "additionalProperties": false,
      "properties": {
        "number": {
          "type": "string",
          "pattern": "^(?:Điều\\s+\\d+[a-zA-Z]?|\\d+(?:\\.\\d+){0,2}|(?=[IVXL])L?X{0,3}(?:IX|IV|V?I{0,3}))$",
          "description": "Dạng `Điều <số>` cho phần đánh số bằng Điều. Bản kèm theo đánh số bằng mục (`1.`, `2.1.`) — Quy trình, Kế hoạch, Chương trình thường thế — thì ghi đúng con số đó, bỏ dấu chấm cuối: `1`, `2.1`. Không tự đổi mục thành Điều, văn bản không viết thế.",
          "examples": ["Điều 1", "Điều 12", "Điều 5a", "1", "2.1", "I", "IV"]
        },
        "heading": { "type": ["string", "null"] },
        "text": {
          "type": "string",
          "minLength": 1,
          "description": "Toàn văn nội dung điều này, chép/gõ lại từ file .txt."
        },
        "isImplementationClause": {
          "type": "boolean",
          "default": false,
          "description": "true nếu đây là điều thuộc phần 'Điều khoản thi hành' (nơi thường có REPLACES/AMENDS/REPEALS)."
        }
      }
    }
  }
}
