{
  "schemaVersion": "1.0",
  "sourceFile": "Đào tạo/0227_2852_QĐ-ĐHĐN_Quy định về việc biên soạn, lựa chọn giáo trình giáo dục đại học dùng chung trong.txt",
  "mappedBy": "mock",
  "note": "Văn bản thật (14KB, 7 Điều trong nội dung kèm theo) — chỉ chép Điều 1, 2, 7; bỏ Điều 3-6 (kinh phí, quy trình 4 bước, hồ sơ) và 3 Phụ lục biểu mẫu trống.",
  "document": {
    "documentNumber": "2852/QĐ-ĐHĐN",
    "title": "Ban hành Quy định về việc biên soạn, lựa chọn giáo trình giáo dục đại học dùng chung trong Đại học Đà Nẵng",
    "documentType": "Quyết định",
    "status": "CON_HIEU_LUC",
    "issueDate": "05/07/2023",
    "effectiveDate": "05/07/2023",
    "expiryDate": null,
    "fileUrl": null,
    "topics": ["Đào tạo", "Học liệu, truyền thông"],
    "targetGroups": ["Cơ sở giáo dục / trường đại học thành viên", "Đơn vị trực thuộc"],
    "summary": "Quy định việc biên soạn và lựa chọn giáo trình dùng chung (GTDC) cho các môn học chung (lý luận chính trị, khoa học cơ bản, ngoại ngữ...) sử dụng từ 2 đơn vị đào tạo trở lên trong ĐHĐN.",
    "idOverride": null
  },
  "organization": {
    "name": "Đại học Đà Nẵng",
    "orgType": null,
    "parentOrg": null,
    "idOverride": null
  },
  "signers": [
    {
      "fullName": "Lê Thành Bắc",
      "academicTitle": "PGS.TS",
      "position": ["Phó Giám đốc"],
      "idOverride": null
    }
  ],
  "citations": [
    {
      "targetDocumentNumber": "32/CP",
      "relationType": "BASED_ON",
      "targetArticle": null,
      "context": "Căn cứ Nghị định số 32/CP ngày 04/4/1994 của Chính phủ về việc thành lập Đại học Đà Nẵng."
    },
    {
      "targetDocumentNumber": "10/2020/TT-BGDĐT",
      "relationType": "BASED_ON",
      "targetArticle": null,
      "context": "Căn cứ Thông tư số 10/2020/TT-BGDĐT ngày 14/5/2020 của Bộ trưởng Bộ Giáo dục và Đào tạo ban hành Quy chế tổ chức và hoạt động của đại học vùng và các cơ sở giáo dục đại học thành viên."
    },
    {
      "targetDocumentNumber": "35/2021/TT-BGDĐT",
      "relationType": "BASED_ON",
      "targetArticle": null,
      "context": "Căn cứ Thông tư số 35/2021/TT-BGDĐT ngày 06/12/2021 của Bộ trưởng Bộ Giáo dục và Đào tạo quy định việc biên soạn, lựa chọn, thẩm định, duyệt và sử dụng tài liệu giảng dạy, giáo trình giáo dục đại học."
    },
    {
      "targetDocumentNumber": "08/NQ-HĐĐH",
      "relationType": "BASED_ON",
      "targetArticle": null,
      "context": "Căn cứ Nghị quyết số 08/NQ-HĐĐH ngày 12/7/2021 của Hội đồng Đại học Đà Nẵng về việc ban hành Quy chế tổ chức và hoạt động của Đại học Đà Nẵng."
    }
  ],
  "mentions": ["Ban Đào tạo"],
  "normativeContents": [
    {
      "title": "Quy định về việc biên soạn, lựa chọn giáo trình giáo dục đại học dùng chung trong Đại học Đà Nẵng",
      "contentType": "Quy định",
      "status": null,
      "idOverride": null,
      "articles": [
        {
          "number": "Điều 1",
          "heading": "Phạm vi điều chỉnh và đối tượng áp dụng",
          "text": "1. Văn bản này quy định về việc biên soạn, lựa chọn giáo trình giáo dục đại học dùng chung trong toàn ĐHĐN, bao gồm: phạm vi điều chỉnh, đối tượng áp dụng; kinh phí thực hiện; biên soạn giáo trình dùng chung; lựa chọn giáo trình dùng chung; tổ chức thực hiện. 2. Áp dụng đối với các trường đại học thành viên, khoa, viện, phân hiệu, trung tâm trực thuộc, đối với tất cả các hình thức đào tạo, trình độ đào tạo. 3. Không áp dụng đối với giáo trình các môn lý luận chính trị và quốc phòng - an ninh do Bộ GD&ĐT tổ chức biên soạn.",
          "isImplementationClause": false
        },
        {
          "number": "Điều 2",
          "heading": "Giải thích từ ngữ",
          "text": "1. Môn chung là những môn học trang bị kiến thức, kỹ năng thuộc kiến thức giáo dục đại cương, khoa học cơ bản như: Triết học, Kinh tế chính trị, Chủ nghĩa xã hội khoa học, Lịch sử Đảng, Tư tưởng Hồ Chí Minh, Pháp luật đại cương, Tâm lý, Xác suất thống kê, Ngoại ngữ cơ bản, Giáo dục thể chất, Toán, Vật lí, Hóa học. 2. Giáo trình dùng chung (GTDC) là tài liệu giảng dạy, học tập, nghiên cứu chính của các môn chung được sử dụng từ 02 đơn vị trở lên.",
          "isImplementationClause": false
        },
        {
          "number": "Điều 7",
          "heading": "Tổ chức thực hiện",
          "text": "1. Thủ trưởng đơn vị đào tạo phụ trách giảng dạy môn chung tổ chức rà soát những GTDC hiện đang sử dụng và thực hiện theo Quy định này. 3. Trường hợp các văn bản quy phạm pháp luật được dẫn chiếu để áp dụng tại Quy định này được sửa đổi, bổ sung, thay thế thì sẽ áp dụng theo các văn bản sửa đổi, bổ sung, thay thế đó.",
          "isImplementationClause": true
        }
      ]
    }
  ],
  "articles": [
    {
      "number": "Điều 1",
      "heading": "Ban hành kèm theo",
      "text": "Ban hành kèm theo Quyết định này Quy định về việc biên soạn, lựa chọn giáo trình giáo dục đại học dùng chung trong Đại học Đà Nẵng.",
      "isImplementationClause": false
    },
    {
      "number": "Điều 2",
      "heading": "Hiệu lực thi hành",
      "text": "Quyết định này có hiệu lực kể từ ngày ký.",
      "isImplementationClause": true
    },
    {
      "number": "Điều 3",
      "heading": "Trách nhiệm thi hành",
      "text": "Chánh Văn phòng, Trưởng các ban hữu quan, Hiệu trưởng các trường đại học thành viên, Thủ trưởng các đơn vị đào tạo thuộc và trực thuộc chịu trách nhiệm thi hành Quyết định này.",
      "isImplementationClause": false
    }
  ]
}
