{
  "schemaVersion": "1.0",
  "sourceFile": "Hợp tác quốc tế/0322_1787_ĐHĐN-KHHTQT_Sửa đổi, bổ sung điều khoản về thủ tục tiếp nhận người nước ngoài đến học tập,.txt",
  "mappedBy": "mock",
  "note": "Văn bản thật, Công văn không có cấu trúc Điều/QUYẾT ĐỊNH (chỉ có Kính gửi + khoản đánh số) -- để trống articles/normativeContents theo đúng thực tế, nội dung tóm tắt ở summary. Có phiếu giải quyết văn bản đến ở cuối file gốc (không đưa vào JSON vì không phải nội dung của chính văn bản).",
  "document": {
    "documentNumber": "1787/ĐHĐN-KHHTQT",
    "title": "V/v sửa đổi, bổ sung điều khoản về thủ tục tiếp nhận người nước ngoài đến học tập, nghiên cứu và làm việc tại ĐHĐN",
    "documentType": "Công văn",
    "status": "CON_HIEU_LUC",
    "issueDate": "13/05/2024",
    "effectiveDate": "13/05/2024",
    "expiryDate": null,
    "fileUrl": null,
    "topics": ["Hợp tác quốc tế"],
    "targetGroups": ["Doanh nghiệp, đối tác/tổ chức nước ngoài"],
    "summary": "Sửa đổi, bổ sung khoản 1 và khoản 2 Điều 5 (Thủ tục tiếp nhận người nước ngoài, Chương II Quản lý đoàn vào) của Quyết định 2268/ĐHĐN-HTQT: cho phép dùng tài khoản Cổng dịch vụ công Bộ Công an để nộp hồ sơ xuất nhập cảnh của người nước ngoài đến học tập, nghiên cứu, làm việc tại ĐHĐN.",
    "idOverride": null
  },
  "organization": {
    "name": "Đại học Đà Nẵng",
    "orgType": null,
    "parentOrg": null,
    "idOverride": null
  },
  "signers": [
    {
      "fullName": "Lê Quang Sơn",
      "academicTitle": "PGS.TS",
      "position": ["Phó Giám đốc"],
      "idOverride": null
    }
  ],
  "citations": [
    {
      "targetDocumentNumber": "2268/ĐHĐN-HTQT",
      "relationType": "AMENDS",
      "targetArticle": "Điều 5",
      "context": "Căn cứ Quyết định 2268/ĐHĐN-HTQT ngày 01/6/2023 của ĐHĐN ban hành Quy định về công tác quản lý hoạt động hợp tác quốc tế (HTQT) tại ĐHĐN, ĐHĐN sửa đổi và bổ sung Điều 5. Thủ tục tiếp nhận người nước ngoài của Chương II Quản lý đoàn vào."
    }
  ],
  "mentions": ["Ban Khoa học và Hợp tác quốc tế"],
  "normativeContents": [],
  "articles": []
}
